{
  "schema_version": "1.0.0",
  "report_id": "QAR-2026-Q3-v1.0",
  "report_type": "live",
  "provider": {
    "name": "Meridian Knowledge Solutions",
    "fedramp_id": "FR2527956755",
    "service_name": "Meridian LMS",
    "impact_level": "Moderate"
  },
  "reporting_period": {
    "quarter": "2026-Q3",
    "generated_at": "2026-07-06T15:25:54.520301+00:00",
    "next_review_date": "2026-10-04"
  },
  "executive_summary": {
    "compliance_rate": 0.0,
    "total_ksis": 0,
    "passed_ksis": 0,
    "validation_window_days": 14,
    "global_status": "OPERATIONAL"
  },
  "compliance_trend": {
    "window_days": 14,
    "data_points": []
  },
  "significant_changes": [],
  "planned_changes": [],
  "compliance_attestations": {
    "qr_02": true,
    "qr_04": true,
    "qr_05": true,
    "qr_06": true,
    "qr_11": false
  },
  "integrity": {
    "generated_at": "2026-07-06T15:25:54.520301+00:00",
    "generator_version": "2.0.0",
    "report_version": "QAR-2026-Q3-v1.0",
    "content_hash": "5360e1c0cb4839a2a30e547e2530424f463f2ca62faa3017d2419bd47db30e31"
  }
}